{
  "author": "GenWave",
  "description": "Thirty fictional sponsors for a station that never had any: a mattress barn on its ninth final sale, a museum of things that are probably fine, overnight dishes you never see done. Small-town businesses, dubious institutes, and civic programs gone slightly wrong — every one invented, every phone number a 555, zero real brands. The first-party starter universe for the Ads page.",
  "audience": "everyone",
  "added": "2026-09-05",
  "bestFor": [
    "starter",
    "small town",
    "parody"
  ]
}
