{
  "author": "GenWave",
  "description": "Retro-space-age grotesque with Space Mono's skeleton \u2014 a display or sans voice for tech-leaning looks. Variable weight 300-700, latin subset.",
  "audience": "everyone",
  "added": "2026-08-05",
  "bestFor": [
    "display",
    "tech",
    "sans"
  ]
}
