{
  "author": "Test Fixture",
  "description": "Green-variant kind:\"show\" fixture carrying a valid envelope.rotation (schema 1.1, SPEC F118.1/F152.6, PLAN T364) for tools/run_selftest.sh and tools/validate.py — copied into a temporary entries/ tree at test time to exercise kind-aware validation and index building end to end (show-manifest.schema.json, show-meta.schema.json, build_index.py's kind-aware output shape, tools/lint.py's show-rotation-bounds rule staying quiet on a valid rotation). Not a real catalog entry, and NOT itself under entries/.",
  "audience": "everyone",
  "added": "2026-08-29"
}
