{
  "author": "Test Fixture",
  "description": "Green-variant kind:\"show\" fixture carrying SPEC F152.3's own documented envelope.rotation payload shape (a null notAiredWithinDays bound alongside a set maxPlays), PLAN T364 review MED-1 — for tools/run_selftest.sh and tools/validate.py, copied into a temporary entries/ tree at test time to exercise kind-aware validation and index building end to end. Not a real catalog entry, and NOT itself under entries/.",
  "audience": "everyone",
  "added": "2026-08-29"
}
