{
  "author": "Red Fixture",
  "description": "Red-variant fixture: a stray .woff2 sits in a show entry directory that has no legitimate extra-file allowance (show's KindSpec.allows_extra is always False, unlike font's) \u2014 must fail tools/validate.py's unexpected-file gate (security review NOTE 4, T253).",
  "audience": "everyone",
  "added": "2026-08-11"
}
