{
  "author": "GenWave",
  "description": "Every roster DJ's take-three face, cut to the shelf's 512×512 avatar-pack shape from the house transparent master set. A neutral working title for the third of four variant groupings — not yet a themed pack.",
  "audience": "everyone",
  "added": "2026-08-16"
}
