{
  "author": "Red Fixture",
  "description": "Red-variant kind:\"font\" fixture (SPEC F104.1 / T195) — files[] declares the SAME asset filename twice (\"upright\" and \"italic\" both pointing at the one physical woff2), proving tools/validate.py's validate_font_pack rejects a manifest that declares an asset more than once.",
  "audience": "everyone",
  "added": "2026-08-05"
}
