{
  "author": "Red Fixture",
  "description": "Red-variant kind:\"font\" fixture (SPEC F104.1/F104.2 / T195) — the manifest's files[] names a face (\"font-orphan-manifest-variable-latin.woff2\") the entry never actually ships, proving tools/validate.py's validate_font_pack rejects a manifest referencing an asset the entry doesn't carry.",
  "audience": "everyone",
  "added": "2026-08-05"
}
